{
  "certificate": null,
  "openings": [],
  "outline": [
    [
      0.0,
      0.0
    ],
    [
      8.0,
      0.0
    ],
    [
      8.0,
      8.0
    ],
    [
      0.0,
      8.0
    ]
  ],
  "rooms": [
    {
      "h": 5.3,
      "id": "p000",
      "type": "living_room",
      "w": 4.6,
      "x": 0.0,
      "y": 0.0
    },
    {
      "h": 3.1,
      "id": "p001",
      "type": "bedroom",
      "w": 3.8,
      "x": 4.2,
      "y": 0.0
    },
    {
      "h": 1.9,
      "id": "p002",
      "type": "kitchen",
      "w": 3.7,
      "x": 4.3,
      "y": 3.4
    },
    {
      "h": 2.4,
      "id": "p003",
      "type": "bathroom",
      "w": 2.6,
      "x": 0.0,
      "y": 5.6
    },
    {
      "h": 2.7,
      "id": "p004",
      "type": "bedroom",
      "w": 5.6,
      "x": 2.4,
      "y": 5.3
    }
  ],
  "schema": "2",
  "walls": []
}
