{
  "certificate": null,
  "openings": [],
  "outline": [
    [
      0.0,
      0.0
    ],
    [
      8.5,
      0.0
    ],
    [
      8.5,
      7.0
    ],
    [
      0.0,
      7.0
    ]
  ],
  "rooms": [
    {
      "h": 7.0,
      "id": "living",
      "type": "living_room",
      "w": 5.08,
      "x": 0.0,
      "y": 0.0
    },
    {
      "h": 4.5,
      "id": "bedroom",
      "type": "bedroom",
      "w": 3.5,
      "x": 5.0,
      "y": 0.0
    },
    {
      "h": 2.5,
      "id": "bathroom",
      "type": "bathroom",
      "w": 3.5,
      "x": 5.0,
      "y": 4.5
    }
  ],
  "schema": "2",
  "walls": []
}
