{
  "certificate": null,
  "openings": [],
  "outline": [
    [
      0.0,
      0.0
    ],
    [
      11.0,
      0.0
    ],
    [
      11.0,
      9.0
    ],
    [
      0.0,
      9.0
    ]
  ],
  "rooms": [
    {
      "h": 9.0,
      "id": "living",
      "type": "living_room",
      "w": 6.1,
      "x": 0.0,
      "y": 0.0
    },
    {
      "h": 4.0,
      "id": "bedroom-1",
      "type": "bedroom",
      "w": 5.0,
      "x": 6.0,
      "y": 0.0
    },
    {
      "h": 3.0,
      "id": "bedroom-2",
      "type": "bedroom",
      "w": 5.0,
      "x": 6.0,
      "y": 4.04
    },
    {
      "h": 1.96,
      "id": "bathroom",
      "type": "bathroom",
      "w": 5.0,
      "x": 6.0,
      "y": 7.04
    }
  ],
  "schema": "2",
  "walls": [
    {
      "a": [
        6.0,
        0.0
      ],
      "b": [
        6.0,
        9.0
      ],
      "id": "axis-3",
      "load_bearing": true,
      "thickness": 0.1
    }
  ]
}
